{
  "schema_version": 3,
  "interface_id": "geoanalystbench-producer-interface-v3/gab-36-vegetation-change",
  "case_id": "gab-36-vegetation-change",
  "base_freeze_id": "geoanalystbench-derived-v1",
  "base_suite_sha256": "c99563100cacc1e03234edd82ec64f4f47dc9479ca2ca4f9aabe84a1d5373f12",
  "contract_freeze_id": "geoanalystbench-derived-contracts-v3",
  "contract_suite_sha256": "e17b9ee3f6d69ba99aacc90cab998339bf0f679c76ce25645e09a70e882ad3f2",
  "disclosure_boundary": {
    "includes": ["artifact paths", "nested field names", "formats", "method evidence", "serialization rules", "execution hints"],
    "excludes": ["reference outputs", "expected analytical values", "validator source"]
  },
  "execution_hints": [
    "Use one deterministic local script when helpful; place it in the current workspace root, never an operating-system temporary directory.",
    "Do not install dependencies or use network access; use the standard library and only packages that already import successfully.",
    "Write text artifacts explicitly as UTF-8 and keep generated source ASCII-safe on Windows by using Unicode escape sequences when needed."
  ],
  "method_contract": [
    "Scale red and near-infrared digital numbers by the fixture reflectance scale factor before computing SAVI.",
    "Compute SAVI as (1 + L) * (NIR - red) / (NIR + red + L), then compute delta_savi as post minus pre.",
    "Define valid_overlap as the Boolean intersection of the pre-event and post-event quality masks and exclude every false cell from all statistics.",
    "Classify a valid cell as damaged when delta_savi is less than or equal to the applicable threshold."
  ],
  "artifacts": [
    {
      "path": "outputs/savi-change.json",
      "format": "JSON",
      "required_fields": ["schema_version", "crs", "rows", "columns", "pre_savi", "post_savi", "delta_savi", "valid_overlap", "damage_mask"],
      "requirements": ["Use schema_version 1 and preserve the fixture grid shape.", "Store valid_overlap as true or false at every grid cell, including false at invalid cells.", "Store null at invalid cells in pre_savi, post_savi, delta_savi, and damage_mask; store Boolean damage values at valid cells."]
    },
    {
      "path": "outputs/damage-pixels.geojson",
      "format": "GeoJSON",
      "required_fields": ["type", "crs", "features[].geometry", "features[].properties.row", "features[].properties.column", "features[].properties.delta_savi", "features[].properties.pixel_area_m2"],
      "requirements": ["Use a FeatureCollection in the fixture CRS.", "Write one polygon feature per damaged valid pixel at the registered damage threshold.", "Derive polygon dimensions and pixel_area_m2 from the fixture grid metadata."]
    },
    {
      "path": "outputs/change-summary.csv",
      "format": "CSV",
      "required_fields": ["threshold", "damaged_pixels", "damaged_area_hectares", "valid_pixels", "valid_overlap_percent"],
      "requirements": ["Use this exact column order.", "Write exactly one row for each fixture sensitivity threshold in fixture order.", "Serialize threshold cells with exactly three decimal places, including trailing zeroes: -0.150, -0.200, and -0.250."]
    },
    {
      "path": "outputs/provenance.json",
      "format": "JSON",
      "required_fields": ["schema_version", "sensor", "product_level", "crs", "pre_acquired", "post_acquired", "phenology", "reflectance_scale_factor", "savi_l", "damage_threshold", "pixel_width_m", "pixel_height_m", "co_registration_rmse_pixels", "valid_pixels", "total_pixels", "valid_overlap_percent"],
      "requirements": ["Use schema_version 1.", "Copy declared acquisition and processing metadata from the fixture.", "Derive validity counts and overlap percentage from the intersected masks."]
    }
  ]
}
