{
  "schema_version": 3,
  "interface_id": "geoanalystbench-producer-interface-v3/gab-38-travel-time",
  "case_id": "gab-38-travel-time",
  "base_freeze_id": "geoanalystbench-derived-v1",
  "base_suite_sha256": "c99563100cacc1e03234edd82ec64f4f47dc9479ca2ca4f9aabe84a1d5373f12",
  "contract_freeze_id": "geoanalystbench-derived-contracts-v3",
  "contract_suite_sha256": "e17b9ee3f6d69ba99aacc90cab998339bf0f679c76ce25645e09a70e882ad3f2",
  "disclosure_boundary": {
    "includes": ["artifact paths", "nested field names", "formats", "method evidence", "serialization rules", "execution hints"],
    "excludes": ["reference outputs", "expected analytical values", "validator source"]
  },
  "execution_hints": [
    "Use one deterministic local script when helpful; place it in the current workspace root, never an operating-system temporary directory.",
    "Do not install dependencies or use network access; use the standard library and only packages that already import successfully.",
    "Write text artifacts explicitly as UTF-8 and keep generated source ASCII-safe on Windows by using Unicode escape sequences when needed."
  ],
  "method_contract": [
    "Run a directed least-cost search on time_minutes, not geometric distance.",
    "Represent search state with enough incoming-path context to enforce each forbidden turn; a node-only visited state is insufficient when turn restrictions exist.",
    "Use deterministic node-ID ordering when equal-cost alternatives remain after all declared constraints are applied."
  ],
  "artifacts": [
    {
      "path": "outputs/travel-times.csv",
      "format": "CSV",
      "required_fields": ["destination_id", "reachable", "travel_time_minutes", "path"],
      "requirements": ["Use this exact column order and write one row for every listed destination.", "Serialize CSV node paths as greater-than-separated node IDs with no spaces, for example NODE1>NODE2; do not write JSON arrays or pipe-separated paths in CSV.", "For unreachable destinations write lowercase false and empty CSV cells for travel_time_minutes and path; never write the literal text null or None."]
    },
    {
      "path": "outputs/routes.geojson",
      "format": "GeoJSON",
      "required_fields": ["type", "crs", "features[].geometry", "features[].properties.destination_id", "features[].properties.path", "features[].properties.travel_time_minutes"],
      "requirements": ["Use a FeatureCollection in the fixture CRS.", "Write exactly one LineString feature per reachable destination.", "Route coordinates must follow the reported node path order.", "Unlike the CSV representation, store each GeoJSON path property as an ordered JSON array of node-ID strings, for example [\"NODE1\", \"NODE2\"]."]
    },
    {
      "path": "outputs/summary.json",
      "format": "JSON",
      "required_fields": ["schema_version", "origin", "crs", "directed", "cost_field", "cost_units", "destination_count", "reachable_count", "unreachable_count"],
      "requirements": ["Use schema_version 1.", "Report counts from the produced destination rows rather than hard-coding them."]
    }
  ]
}
